ticket_id,created_at,first_response_at,resolved_at,closed_at,category,priority,status,requesting_location,assigned_department,assigned_owner,escalation_flag,reopened_flag,pending_flag,sla_target_hours,resolution_hours,response_hours,sla_met_flag,summary,resolution_notes
INC-100001,5/20/2026 8:12,5/20/2026 8:24,5/20/2026 10:45,5/20/2026 11:02,Inventory & Supply,Priority 2 — High,Closed,Raleigh Specialty Clinic 03,Supply & Inventory Operations,Jordan Lee,FALSE,FALSE,FALSE,24,2.55,0.2,TRUE,Inventory shortage reported for high-use clinical supply,Emergency inventory transfer completed from Cary Distribution Hub 01
INC-100002,5/20/2026 9:03,5/20/2026 9:40,5/21/2026 14:15,5/21/2026 14:42,Vendor & Delivery Management,Priority 2 — High,Closed,Durham Outpatient Clinic 07,Vendor & Service Management,Samantha Ortiz,TRUE,FALSE,TRUE,24,29.2,0.62,FALSE,Delayed vendor shipment impacting clinic inventory availability,Vendor escalation completed and expedited replacement shipment arranged
INC-100003,5/20/2026 10:11,5/20/2026 10:29,5/20/2026 13:48,5/20/2026 14:03,Scheduling & Resource Coordination,Priority 3 — Moderate,Closed,Wake Forest Clinic 11,Clinical Operations Support,Marcus Nguyen,FALSE,FALSE,FALSE,72,3.62,0.3,TRUE,Staff scheduling conflict affecting afternoon patient support coverage,Temporary staffing reassignment coordinated successfully
INC-100004,5/20/2026 11:26,5/20/2026 11:55,,,Data Quality & Compliance,Priority 3 — Moderate,In Progress,Raleigh Specialty Clinic 03,Data Quality & Compliance,Avery Patel,FALSE,FALSE,FALSE,72,,0.48,,Duplicate operational records identified during reporting audit,
INC-100005,5/20/2026 13:18,5/20/2026 13:52,5/21/2026 9:14,5/21/2026 9:40,Operational Incident,Priority 1 — Critical,Closed,Cary Distribution Hub 01,Operations Coordination Center,Taylor Brooks,TRUE,FALSE,FALSE,4,19.93,0.57,FALSE,Distribution workflow interruption impacting multiple clinic deliveries,Emergency operational rerouting initiated and distribution backlog stabilized
